Intent,Question,Answer
question_data_set,what part of beef are rouladen cut from?,The cut is usually topside beef or silverside since this is the cheaper cut.
question_data_set,where does cellular respiration occur,"Cellular respiration is the set of the metabolic reactions and processes that take place in the cells of organisms to convert biochemical energy from nutrients into adenosine triphosphate (ATP), and then release waste products."
question_data_set,who created massey ferguson,"The company was formed by a merger between Massey Harris and the Ferguson Company farm machinery manufacturer in 1953, creating the company Massey Harris Ferguson."
question_data_set,what is a lapping machine,"Lapping is a machining process, in which two surfaces are rubbed together with an abrasive between them, by hand movement or by way of a machine."
question_data_set,who plays ethan in my babysitter's a vampire,"The show follows Ethan Morgan ( Matthew Knight ), who, in the television film, learns that his babysitter Sarah ( Vanessa Morgan ) is a vampire ."
question_data_set,where do the mohawks live,"Kanien'kehá:ka (""People of the Place of Flint"") are an Iroquoian -speaking indigenous people of North America originally from the Mohawk Valley in upstate New York ."
question_data_set,where do the mohawks live,Their current settlements include areas around Lake Ontario and the St Lawrence River in Canada .
question_data_set,where do the mohawks live,"Their traditional homeland stretched southward of the Mohawk River , eastward to the Green Mountains of Vermont , westward to the border with the Oneida Nation 's traditional homeland territory, and northward to the St Lawrence River."
question_data_set,when did proof die,"DeShaun Dupree Holton (October 2, 1973 – April 11, 2006), better known by his stage name Proof, was an American rapper and actor from Detroit , Michigan ."
question_data_set,when did proof die,"In 2006, Proof was shot and killed during an altercation at the CCC nightclub in Detroit."
question_data_set,what is a base SI unit,"The seven SI base units and the interdependency of their definitions: for example, to extract the definition of the metre from the speed of light , the definition of the second must be known while the ampere and candela are both dependent on the definition of energy which in turn is defined in terms of length , mass and time ."
question_data_set,when did ww1 end?,World War I (WWI) was a global war centred in Europe that began on 28 July 1914 and lasted until 11 November 1918.
question_data_set,what state is area code 419,North American telephone area codes 419 and 567 serve the northwest quadrant of the U.S. state of Ohio .
question_data_set,what is 9/11 bombings,"The September 11 attacks (also referred to as September 11, September 11th, or 9/11) were a series of four coordinated terrorist attacks launched by the Islamic terrorist group al-Qaeda upon the United States in New York City and the Washington, D.C. area on September 11, 2001."
question_data_set,what are social security taxes,"Tax deposits are formally entrusted to the Federal Old-Age and Survivors Insurance Trust Fund, the Federal Disability Insurance Trust Fund, the Federal Hospital Insurance Trust Fund, or the Federal Supplementary Medical Insurance Trust Fund which comprise the Social Security Trust Fund ."
question_data_set,what town is laurel hollow ny in,"Laurel Hollow is a village in the Town of Oyster Bay in Nassau County, New York in the United States ."
question_data_set,when did charles dickens live,Charles John Huffam Dickens (; 7 February 1812 – 9 June 1870) was an English writer and social critic.
question_data_set,when did the civil rights movement begin,The civil rights movement was a series of worldwide political movements for equality before the law that peaked in the 1960s.
question_data_set,who won fifa world cup 2010,"In the final, Spain , the European champions , defeated third-time finalists the Netherlands 1–0 after extra time , with Andrés Iniesta 's goal in the 116th minute giving Spain their first world title, becoming the eighth nation to win the tournament, and the first European nation to win the tournament outside its home continent."
question_data_set,when did egg mcmuffin get invented,The Egg McMuffin is the signature breakfast sandwich; it was invented by the late McDonald's franchisee Herb Peterson in the late 1960s and was introduced nationwide in 1972.
question_data_set,who shot john lennon?,"He was shot by Mark David Chapman at the entrance of the building where he lived, The Dakota , in New York City on 8 December 1980."
question_data_set,what state is new orleans in,"New Orleans ( or , locally or ; ) is a major United States port and the largest city and metropolitan area in the state of Louisiana ."
question_data_set,what where the most important factors that led to the defeat of the democrates in 1968?,"It was a wrenching national experience, conducted during a year of violence that included the assassination of civil rights leader Martin Luther King, Jr. , and subsequent race riots across the nation, the assasination of Democratic presidential candidate Robert F. Kennedy , widespread opposition to the Vietnam War across university campuses, and violent confrontations between police and anti-war protesters at the 1968 Democratic National Convention as the Democratic party split again and again."
question_data_set,when did kurt cobain kill himself,"On April 8, 1994, Cobain was found dead at his home in Seattle , the victim of what was officially ruled a suicide by a self-inflicted shotgun wound to the head."
question_data_set,who starred in the original true grit,John Wayne stars as U.S. Marshal Rooster Cogburn and won his only Academy Award for his performance in this film.
question_data_set,what is a millwright worker,A millwright is a craftsman or tradesman engaged with the construction and maintenance of machinery .
question_data_set,what the names of destiny's child,"Destiny's Child was an American R&B girl group whose final, and perhaps most recognizable, line-up comprised Beyoncé Knowles , Kelly Rowland and Michelle Williams ."
question_data_set,who created the tourbillon movement?,"Developed around 1795 by the French-Swiss watchmaker Abraham-Louis Breguet from an earlier idea by the English chronometer maker John Arnold , a tourbillon aims to counter the effects of gravity by mounting the escapement and balance wheel in a rotating cage, to negate the effect of gravity when the timepiece (thus the escapement) is stuck in a certain position."
question_data_set,what is an .msi file,"The Windows Installer (previously known as Microsoft Installer) is a software component used for the installation, maintenance, and removal of software on modern Microsoft Windows systems."
question_data_set,what year did mexico gain independence from spain,"The Mexican War of Independence (1810–1821) was an armed conflict between the people of Mexico and the Spanish colonial authorities which started on September 16, 1810."
question_data_set,What are procedure codes terms in coding?,Procedure codes are numbers or alphanumeric codes used to identify specific health interventions taken by medical professionals.
question_data_set,what is a Four Lokos,"Four Loko is a line of alcoholic beverages , originally marketed as energy drinks , sold by Phusion Projects of Chicago, Illinois ."
question_data_set,what is a fret on a guitar,A fret is a raised element on the neck of a stringed instrument .
question_data_set,what year was smokey the bear invented,"An advertising campaign featuring Smokey was created in 1944 with the slogan, ""Smokey Says – Care Will Prevent 9 out of 10 Forest Fires""."
question_data_set,who said tv is a vast wasteland,"Newton Norman Minow (born January 17, 1926) is an American attorney and former Chairman of the Federal Communications Commission ."
question_data_set,what is a duvet cover used for,"A duvet ( or ; ; from the French duvet ""down""), also known as a doona in Australian English or a continental quilt (or simply quilt) in British English , but this usage is no longer common, is a type of bedding , a soft flat bag filled with down , feathers , wool , silk or a synthetic alternative, and protected with a removable cover, analogous to a pillow and pillow case."
question_data_set,who did mr bojangles,"""Mr. Bojangles"" is the title of a song originally written and recorded by American country music artist Jerry Jeff Walker for his 1968 album of the same title."
question_data_set,what is an agents job role in film,"A talent agent, or booking agent, is a person who finds jobs for actors , authors , film directors , musicians , models , producers, professional athletes , writers and other people in various entertainment businesses."
question_data_set,what is an agents job role in film,"An agent also defends, supports and promotes the interest of his/her clients."
question_data_set,"who discovered the 2 moons of mars,Phobos and Deimos","Both satellites were discovered in 1877 by Asaph Hall and are named after the characters Phobos (panic/fear) and Deimos (terror/dread) who, in Greek mythology , accompanied their father Ares , god of war, into battle."
question_data_set,WHAT IS A LAW ENFORCEMENT MURDER BOOK,"In law enforcement parlance, the term murder book refers to the case file of a murder investigation."
question_data_set,where does angela davis currently work,"She is a retired professor with the History of Consciousness Department at the University of California, Santa Cruz , and is the former director of the university's Feminist Studies department."
question_data_set,when album love always released,"Love Always is the debut album of American R&B duo K-Ci & JoJo , released on June 17, 1997, by MCA Records ."
question_data_set,who wrote west side story,"West Side Story is an American musical with a book by Arthur Laurents , music by Leonard Bernstein , lyrics by Stephen Sondheim , and conception and choreography by Jerome Robbins ."
question_data_set,who killed robert kennedy,"Sirhan Sirhan , a 24-year-old Palestinian / Jordanian immigrant , was convicted of Kennedy's murder and is serving a life sentence for the crime."
question_data_set,when Harry met Sally case,"The film raises the question ""Can men and women ever just be friends?"" and advances many ideas about relationships that became household concepts, such as those of the """" girlfriend and the ""transitional person""."
question_data_set,who owns hamburger helper,It is made by General Mills .
question_data_set,what makes a dwarf planet,A dwarf planet is a planetary-mass object that is neither a planet nor a satellite .
question_data_set,what makes a dwarf planet,"More explicitly, the International Astronomical Union (IAU) defines a dwarf planet as a celestial body in direct orbit of the Sun that is massive enough for its shape to be controlled by gravitation , but that unlike a planet has not cleared its orbital region of other objects."
question_data_set,when did jack lalanne die,"Francois Henri ""Jack"" LaLanne (September 26, 1914 - January 23, 2011) was an American fitness , exercise , and nutritional expert and motivational speaker who is sometimes called ""the godfather of fitness"" and the ""first fitness superhero."""
question_data_set,who made the original care bears,The Care Bears are characters created by American Greetings in 1981 for use on greeting cards .
question_data_set,what states does interstate 70 travel through,"Interstate 70 (I-70) is an Interstate Highway in the United States that runs from Interstate 15 near Cove Fort, Utah , to a Park and Ride near Baltimore, Maryland ."
question_data_set,when do solar eclipses happen?,"As seen from the Earth , a solar eclipse occurs when the Moon passes between the Sun and Earth, and the Moon fully or partially blocks ("" occults "") the Sun."
question_data_set,where do mangos come from,"The mango is native to South Asia , from where it has been distributed worldwide to become one of the most cultivated fruits in the tropics ."
question_data_set,what latitude is tropic of cancer,It currently (Year 2013) lies at 23° 26′ 15.143′′ north of the Equator.
question_data_set,what video format will play in a DVD player,"Discs using the DVD-Video specification require a DVD drive and an H.262/MPEG-2 Part 2 decoder (e.g., a DVD player, or a computer DVD drive with a software DVD player)."
question_data_set,what part of the government governs the US post office?,"The United States Postal Service (USPS), also known as the Post Office and U.S. Mail, is an independent agency of the United States federal government responsible for providing postal service in the United States."
question_data_set,what state is the capital in,"Washington, D.C. has been the capital of the United States since 1800."
question_data_set,what are square diamonds called?,The face-up shape of the princess cut is square or rectangular and the profile or side-on shape is similar to that of an inverted pyramid with four beveled sides.
question_data_set,what motor does a 2001 monte carlo,"The Monte Carlo SS was revived from 2000 to 2007 and initially powered by 3.8-liter V6 (supercharged in 2004–2005), later to be replaced by a 5.3-liter V8 for 2006–2007."
question_data_set,where scottsdale?,"Scottsdale ( O'odham Vaṣai S-vaṣonĭ; Yaqui Eskatel) is a city in the eastern part of Maricopa County, Arizona , United States , adjacent to Phoenix ."
question_data_set,who has brad pitt dated,"Following a high-profile relationship with actress Gwyneth Paltrow , Pitt was married to actress Jennifer Aniston for five years."
question_data_set,what is a dogs classification,"The domestic dog (Canis lupus familiaris) is a subspecies of the gray wolf (Canis lupus), a member of the Canidae family of the mammalian order Carnivora ."
question_data_set,what year was President kennedy president?,"John Fitzgerald ""Jack"" Kennedy (May 29, 1917 – November 22, 1963), often referred to by his initials JFK, was the 35th President of the United States , serving from 1961 until his death in 1963."
question_data_set,who owns popeyes chicken,"Often referred to as Popeyes and sometimes as Popeyes Chicken & Biscuits or Popeyes Chicken & Seafood, It was acquired by Sandy Springs, Georgia -based AFC Enterprises , originally America's Favorite Chicken Company, in 1993."
question_data_set,what nationality is wendy williams,"Wendy Williams Hunter (born Wendy Joan Williams; July 18, 1964) is an American media personality , actress and author."
question_data_set,who said give me liberty or give me death,"Patrick Henry ""Treason"" speech before the House of Burgesses in an 1851 painting by Peter F. Rothermel"
question_data_set,who said give me liberty or give me death,"""Give me liberty, or give me death!"" is a quotation attributed to Patrick Henry from a speech he made to the Virginia Convention ."
question_data_set,what president was theodore roosevelt,"Roosevelt, Jr. ( ; October 27, 1858—January 6, 1919) was the 26th President of the United States (1901–1909)."
question_data_set,who starred in webster,"The show stars Emmanuel Lewis in the title role as a young boy who, after losing his parents, is adopted by his NFL -pro godfather, portrayed by Alex Karras , and his new socialite wife, played by Susan Clark ."
question_data_set,what are the most known sports in america,"Four of the nation's five most popular team sports were developed in North America: American football , baseball , basketball and ice hockey , whereas soccer was developed in England."
question_data_set,what are the most known sports in america,"The four Major leagues in the United States are the National Basketball Association (NBA), National Football League (NFL), Major League Baseball (MLB), the National Hockey League (NHL); all enjoy massive media exposure and are considered the preeminent competitions in their respective sports in the world."
question_data_set,what is a monarch to a monarchy,A monarchy is a form of government in which sovereignty is actually or nominally embodied in a single individual (the monarch ).
question_data_set,"what is an ""N.M?","A newton metre is a unit of torque (also called "" moment "") in the SI system."
question_data_set,what is adem disease,Acute disseminated encephalomyelitis (ADEM) is an immune mediated disease of the brain .
question_data_set,what is adem disease,"It usually occurs following a viral infection but may appear following vaccination , bacterial or parasitic infection, or even appear spontaneously."
question_data_set,what year did john adams become  president?,"John Adams (October 30, 1735 ( O.S. October 19, 1735) – July 4, 1826) was the second president of the United States (1797–1801), having earlier served as the first vice president of the United States ."
question_data_set,who created bing,"Bing (known previously as Live Search, Windows Live Search, and MSN Search) is a web search engine (advertised as a "" decision engine "") from Microsoft ."
question_data_set,who made hubble telescope,"The HST was built by the United States space agency NASA , with contributions from the European Space Agency , and is operated by the Space Telescope Science Institute ."
question_data_set,what are anti inflammatories,Anti-inflammatory refers to the property of a substance or treatment that reduces inflammation .
question_data_set,who sang momma told me not to come,"""Mama Told Me (Not to Come)"" is a song by Randy Newman written for Eric Burdon 's first solo album in 1966."
question_data_set,when did andrea doria sink,"Pronounced was an ocean liner for the Italian Line (Società di navigazione Italia) home ported in Genoa , Italy, most famous for its sinking in 1956, when 52 people died (51 from immediate impact)."
question_data_set,what are dialysis tubes,Dialysis tubing is a type of semi- or partially permeable membrane tubing made from regenerated cellulose or cellophane .
question_data_set,who designed the statue of liberty,"The Statue of Liberty (Liberty Enlightening the World; French: La Liberté éclairant le monde) is a neoclassical sculpture on Liberty Island in New York Harbor , designed by Frédéric Bartholdi and dedicated on October 28, 1886."
question_data_set,what is am 2201,AM-2201 (1-(5-fluoropentyl)-3-(1-naphthoyl)indole) is a research chemical that acts as a potent but nonselective full agonist for the cannabinoid receptor .
question_data_set,who wrote second corinthians,"Paul the Apostle and ""Timothy our brother"" wrote this epistle to ""the church of God which is at Corinth , with all the saints which are in all Achaia ""."
question_data_set,who first synthesized heroin,"Heroin (diacetylmorphine or morphine diacetate ( INN )), also known as diamorphine ( BAN ), and colloquially as H, smack, horse, brown, black, tar, and other names, is an opioid analgesic synthesized by C.R. Alder Wright in 1874 by adding two acetyl groups to the molecule morphine , found in the opium poppy ."
question_data_set,when did george washington died?,"George Washington ( – , 1799) was the first President of the United States (1789–1797), the commander-in-chief of the Continental Army during the American Revolutionary War , and one of the Founding Fathers of the United States ."
question_data_set,when did george washington died?,"He retired from the presidency in 1797 and returned to his home, Mount Vernon , and his domestic life where he managed a variety of enterprises."
question_data_set,what is a wiki platform,"A wiki ( ) is a website which allows its users to add, modify, or delete its content via a web browser usually using a simplified markup language or a rich-text editor ."
question_data_set,what are four thirds cameras,The Four Thirds system is a standard created by Olympus and Kodak for digital single-lens reflex camera (DSLR) design and development.<ref name='DPReview.com 2001-02-13'>
question_data_set,who plays dumbledore in harry potter 6,"After Harris' death, Michael Gambon portrayed Dumbledore for all of the remaining films."
question_data_set,what type of land is savannah,"A savanna, or savannah, is a grassland ecosystem characterized by the trees being sufficiently widely spaced so that the canopy does not close."
question_data_set,who wrote  nature boy,"""Nature Boy"" is a song by Eden Ahbez , published in 1947."
question_data_set,who set the world record for women for high jump,"Stefka Kostadinova ( Bulgaria ) has held the women's world record at since 1987, also the longest-held record in the event."
question_data_set,when did playstation 3 first launch,The launch of the PlayStation 3 into the Japanese market on 10 November 2006 marked the second major seventh generation entertainment system to be released.
question_data_set,where does ground pepper come from,"Black pepper (Piper nigrum) is a flowering vine in the family Piperaceae , cultivated for its fruit , which is usually dried and used as a spice and seasoning ."
question_data_set,where does ground pepper come from,"Black pepper is native to south India , and is extensively cultivated there and elsewhere in tropical regions."
question_data_set,where does ground pepper come from,"Currently Vietnam is the world's largest producer and exporter of pepper, producing 34% of the world's Piper nigrum crop as of 2008."
question_data_set,what type of ecosystem does stingrays live in,"Stingrays are common in coastal tropical and subtropical marine waters throughout the world, and also includes species found in warmer temperate oceans, such as Dasyatis thetidis , and those found in the deep ocean , such as Plesiobatis daviesi ."
question_data_set,who wrote the song cocaine,"""Cocaine"" is a song written and recorded by JJ Cale in 1976, but also known as a cover version recorded by Eric Clapton ."
question_data_set,when did pearl harbor get bombed,"The attack on Pearl Harbor (called Hawaii Operation or Operation AI by the Japanese Imperial General Headquarters (Operation Z in planning) and the Battle of Pearl Harbor) was a surprise military strike conducted by the Imperial Japanese Navy against the United States naval base at Pearl Harbor , Hawaii, on the morning of December 7, 1941 (December 8 in Japan)."
question_data_set,what religion is primary in africa?,The continent's various populations and individuals are mostly adherents of Christianity or Islam .
question_data_set,who won season 2 of project runway,"The winning designer, Chloe Dao , received $100,000 in seed money to help launch her own line, a 2007 Saturn Sky roadster, a spread in ELLE magazine, and a mentorship with the Banana Republic Design Team."
question_data_set,when did marlins start,The Miami Marlins began play in the 1993 season as the Florida Marlins.
question_data_set,what is a mule in coins,"In numismatics , a mule is a coin or medal minted with obverse and reverse designs not normally seen on the same piece."
question_data_set,where do dungeness crab live,"The Dungeness crab, Metacarcinus magister (formerly Cancer magister), is a species of crab that inhabits eelgrass beds and water bottoms on the west coast of North America ."
question_data_set,who plays mary poppins in the movie,"Mary Poppins is a 1964 musical film starring Julie Andrews , Dick Van Dyke , David Tomlinson , and Glynis Johns , produced by Walt Disney , and based on the Mary Poppins books series by P. L. Travers ."
question_data_set,what is an arc in a story plot,"A story arc is an extended or continuing storyline in episodic storytelling media such as television , comic books , comic strips , boardgames , video games , and in some cases, films ."
question_data_set,What are the different translations for the Bible,"The Bible has been translated into many languages from the biblical languages of Hebrew , Aramaic and Greek ."
question_data_set,What are the different translations for the Bible,"The full Bible has been translated into 518 languages, and 2798 languages have at least some portion of the Bible."
question_data_set,when does black friday start for christmas,"Black Friday is the day following Thanksgiving Day in the United States , often regarded as the beginning of the Christmas shopping season."
question_data_set,when does black friday start for christmas,"This was taken to a new extreme in 2011, when several retailers (including Target , Kohl's , Macy's , Best Buy , and Bealls ) opened at midnight for the first time."
question_data_set,when does black friday start for christmas,"In 2012, Walmart and several other retailers announced that they would open most of their stores at 8:00 p.m. on Thanksgiving Day (except in states where opening on Thanksgiving is prohibited due to blue laws , such as Massachusetts where they still opened around midnight), prompting calls for a walkout among some workers."
question_data_set,who sang what a wonderful world,It was first recorded by Louis Armstrong and released as a single in 1967.
question_data_set,what month is the president inaugurated,"The day a presidential inauguration occurs is known as ""Inauguration Day"" and occurs on January 20 (or 21st if the 20th is a Sunday)."
question_data_set,when did Emperor Justinian die,"Justinian I () (, ) (c. 482 – 14 November 565), commonly known as Justinian the Great, was Byzantine Emperor from 527 to 565."
question_data_set,what movement was elizabeth cady stanton a part of,"Elizabeth Cady Stanton (November 12, 1815 – October 26, 1902) was an American social activist , abolitionist, and leading figure of the early women's rights movement ."
question_data_set,what movement was elizabeth cady stanton a part of,"Her Declaration of Sentiments , presented at the first women's rights convention held in 1848 in Seneca Falls , New York , is often credited with initiating the first organized women's rights and women's suffrage movements in the United States."
